{
  "$schema": "../../devtools/laymos/schema.json",
  "sourceRoots": ["src"],
  "ignoredPaths": [
    "src/entry/web/routeTree.gen.ts",
    "src/entry/web/styles.css"
  ],
  "layers": {
    "entry-web": {
      "paths": ["src/entry/web"],
      "description": "Where the browser starts: the router, the document, the offline page, and one thin route for each Place. The router reaches the routes through the generated route tree, so nothing imports them",
      "modules": {
        "src/entry/web/router.tsx": {},
        "src/entry/web/routes": {}
      }
    },
    "entry-worker": {
      "paths": ["src/entry/worker"],
      "description": "Where the Worker starts: /rpc goes to the Ledger API, everything else to the app",
      "modules": {
        "src/entry/worker/server.ts": {}
      }
    },
    "entry-infra": {
      "paths": ["src/entry/infra"],
      "description": "Deployable resources, composed by alchemy.run.ts: the D1 database, its table, and the Worker",
      "modules": {
        "src/entry/infra": {
          "exposed": true
        }
      }
    },
    "client-screens": {
      "paths": ["src/client/screens"],
      "description": "What the user sees: the shell around every Place, each Place, the sheets over them, and the parts they share",
      "modules": {
        "src/client/screens/shell": {
          "exposed": true
        },
        "src/client/screens/places/home": {
          "exposed": true
        },
        "src/client/screens/places/entries": {
          "exposed": true
        },
        "src/client/screens/places/months": {
          "exposed": true
        },
        "src/client/screens/places/settings": {
          "exposed": true
        },
        "src/client/screens/sheets/add": {
          "shared": true
        },
        "src/client/screens/sheets/accounts": {
          "shared": true
        },
        "src/client/screens/sheets/palette": {
          "shared": true
        },
        "src/client/screens/parts": {
          "shared": true
        }
      }
    },
    "client-commands": {
      "paths": ["src/client/commands"],
      "description": "The vocabulary: every Command with its keys, the gesture that gives it on a touch screen, the guide to every gesture, and how each sounds and shows when given",
      "modules": {
        "src/client/commands": {
          "exposed": true
        }
      }
    },
    "client-state": {
      "paths": ["src/client/state"],
      "description": "What the browser keeps and when: the app machine that finds who is signed in and holds one User's Session open, that Session with the User's money in step with D1, this device's Settings, and the copies of every signed-in User",
      "moduleGraphs": {
        "app-state": {
          "description": "The app machine opens and closes Sessions and keeps the copies; screens read the open Session and the device's Settings",
          "path": "src/client/state",
          "modules": {
            "machine": {
              "exposed": true
            },
            "session": {
              "exposed": true
            },
            "settings": {
              "exposed": true
            },
            "local-copies": {}
          },
          "rules": {
            "machine": ["session", "settings", "local-copies"],
            "session": ["local-copies"]
          }
        }
      }
    },
    "client-kit": {
      "paths": ["src/client/kit"],
      "description": "What Ledger needed that no package has yet: sounds made on demand, the Thumb Lock with its Lift Hint, and what the device can be driven by. Each knows nothing of Ledger",
      "modules": {
        "src/client/kit/sound": {
          "exposed": true
        },
        "src/client/kit/thumb-lock": {
          "exposed": true
        },
        "src/client/kit/input": {
          "exposed": true
        }
      }
    },
    "server": {
      "paths": ["src/server"],
      "description": "The Worker's side: the D1 table of every User's money, the Ledger API's handlers, and the host that answers /rpc for the User who signed the request",
      "modules": {
        "src/server/storage": {
          "shared": true,
          "exposed": true
        },
        "src/server/ledger": {
          "shared": true
        },
        "src/server/rpc-host": {
          "exposed": true
        }
      }
    },
    "domain": {
      "paths": ["src/domain"],
      "description": "The words of money, Accounts, Categories, Entries and the currency, with the sums over them and the Ledger API both sides speak; and the device's Settings",
      "modules": {
        "src/domain/ledger": {
          "shared": true,
          "exposed": true
        },
        "src/domain/ledger-api": {
          "exposed": true
        },
        "src/domain/settings": {
          "exposed": true
        }
      }
    }
  },
  "layerGraphs": {
    "kstack": {
      "description": "Read top-down as the folders: entry starts the browser and the Worker; the client's screens over its commands and state; the server; the domain both sides speak at the bottom",
      "rules": {
        "entry-web": ["client-screens", "client-state"],
        "entry-worker": ["entry-infra", "server"],
        "entry-infra": ["server"],
        "client-screens": ["client-commands", "client-state"],
        "client-commands": ["client-kit"],
        "client-state": ["domain"],
        "client-kit": [],
        "server": ["domain"],
        "domain": []
      }
    }
  }
}
