{
  "$schema": "../../devtools/laymos/schema.json",
  "sourceRoots": ["index.ts", "app", "src"],
  "ignoredPaths": [],
  "layers": {
    "entry": {
      "paths": ["index.ts", "app"],
      "description": "Where the phone starts: the runtime made ready for core, then Expo Router's root layout and one thin route for each Place. Expo Router reaches the routes itself, so nothing imports them",
      "modules": {
        "index.ts": {},
        "app": {}
      }
    },
    "screens": {
      "paths": ["src/screens"],
      "description": "What the user sees on a phone: the shell around every Place (Splash, signed-out card, header, Sidebar with the User Switcher, Local Sign-In, the Commands, and the layer gestures mount in), each Place, the Add and Accounts sheets, and the parts they share",
      "moduleGraphs": {
        "screens": {
          "description": "The shell holds the frame and opens the sheets over it; each Place is its own module a route opens, and Entries opens the Accounts sheet to rename one; all of them draw with the shared parts",
          "path": "src/screens",
          "modules": {
            "shell": {
              "exposed": true
            },
            "places/home": {
              "exposed": true
            },
            "places/entries": {
              "exposed": true
            },
            "places/months": {
              "exposed": true
            },
            "places/settings": {
              "exposed": true
            },
            "sheets/add": {},
            "sheets/accounts": {},
            "parts": {}
          },
          "rules": {
            "shell": ["parts", "sheets/add", "sheets/accounts"],
            "places/home": ["parts"],
            "places/entries": ["parts", "sheets/accounts"],
            "places/months": ["parts"],
            "places/settings": ["parts"],
            "sheets/add": ["parts"],
            "sheets/accounts": ["parts"]
          }
        }
      }
    },
    "ledger": {
      "paths": ["src/ledger"],
      "description": "Ledger on the phone, made once from core on the phone's Platform (platform.ts: expo-sqlite, OAuth sign-in, AppState and expo-network) with this build's cloud addresses, with the theme and how Ledger feels: what every screen uses",
      "modules": {
        "src/ledger": {
          "exposed": true
        }
      }
    },
    "runtime": {
      "paths": ["src/runtime"],
      "description": "What Hermes lacks that core expects of a runtime, put in place before anything else loads: crypto.randomUUID and getRandomValues, and the ES2023 change-array-by-copy methods",
      "modules": {
        "src/runtime/hermes.ts": {
          "exposed": true
        }
      }
    }
  },
  "layerGraphs": {
    "ledger-expo": {
      "description": "Read top-down: entry readies the runtime and routes to the screens; the screens stand on Ledger from src/ledger, made on the phone's Platform. Everything shared with the web app is in @ledger/core; generic native UI, gestures and feedback are in @kstackz/expo-toolkit",
      "rules": {
        "entry": ["runtime", "screens"],
        "screens": ["ledger"],
        "ledger": [],
        "runtime": []
      }
    }
  }
}
